{
  "schema_version": "v1.repo_agnostic_source_read_register.1",
  "register_id": "repo_agnostic_source_read_register_20260514",
  "status": "active",
  "purpose": "Track exact internal or external source reads that slice packets may cite instead of relying on chat memory.",
  "reads": [
    {
      "read_id": "methodology_json",
      "surface": "repo_agnostic_durable_slice_build_workflow_methodology_20260514.json",
      "surface_type": "repo_methodology",
      "read_type": "docs",
      "status": "satisfied",
      "owner_slice": "slice_001",
      "evidence_ref": "repo_agnostic_durable_slice_build_workflow_methodology_20260514.json",
      "summary": "Canonical workflow doctrine, starter artifacts, slice packet contract, refresh discipline, and bootstrap sequence."
    },
    {
      "read_id": "low_token_contract",
      "surface": "contracts/low_token_workflow_contract.json",
      "surface_type": "contract",
      "read_type": "docs",
      "status": "satisfied",
      "owner_slice": "slice_001",
      "evidence_ref": "contracts/low_token_workflow_contract.json",
      "summary": "Portable compact-read policy: query or inventory first, bounded targeted reads, compact command output, and explicit wider-read escalation."
    },
    {
      "read_id": "read_only_harness_contract",
      "surface": "contracts/read_only_command_harness.json",
      "surface_type": "contract",
      "read_type": "docs",
      "status": "satisfied",
      "owner_slice": "slice_001",
      "evidence_ref": "contracts/read_only_command_harness.json",
      "summary": "Policy for compact read-only commands, before/after snapshots, git porcelain comparison, and secret-like output scanning."
    },
    {
      "read_id": "source_read_register_validator",
      "surface": "scripts/validate_source_read_register.py",
      "surface_type": "validator",
      "read_type": "full_source",
      "status": "satisfied",
      "owner_slice": "slice_001",
      "evidence_ref": "scripts/validate_source_read_register.py",
      "summary": "Dependency-free validator proving source-read register structure, evidence refs, statuses, duplicate ids, and path safety."
    },
    {
      "read_id": "planned_future_surfaces_validator",
      "surface": "scripts/validate_planned_future_surfaces.py",
      "surface_type": "validator",
      "read_type": "full_source",
      "status": "satisfied",
      "owner_slice": "slice_001",
      "evidence_ref": "scripts/validate_planned_future_surfaces.py",
      "summary": "Dependency-free validator proving future-surface ids, paths, owner slices, statuses, and activation packet references."
    },
    {
      "read_id": "command_map_validator",
      "surface": "scripts/validate_command_map.py",
      "surface_type": "validator",
      "read_type": "full_source",
      "status": "satisfied",
      "owner_slice": "slice_001",
      "evidence_ref": "scripts/validate_command_map.py",
      "summary": "Dependency-free validator proving command/helper map structure, side-effect classification, read-only harness safety, and command summary counts."
    },
    {
      "read_id": "query_command_map",
      "surface": "scripts/query_command_map.py",
      "surface_type": "other",
      "read_type": "full_source",
      "status": "satisfied",
      "owner_slice": "slice_001",
      "evidence_ref": "scripts/query_command_map.py",
      "summary": "Dependency-free command-map query helper for command id, entry type, side-effect class, safe-read-only, and path filters."
    },
    {
      "read_id": "mature_repo_migration_validator",
      "surface": "scripts/validate_mature_repo_migration_packet.py",
      "surface_type": "validator",
      "read_type": "full_source",
      "status": "satisfied",
      "owner_slice": "slice_001",
      "evidence_ref": "scripts/validate_mature_repo_migration_packet.py",
      "summary": "Dependency-free validator proving mature-repo adoption packets preserve local authority, protect high-risk paths, and require explicit operator approval."
    },
    {
      "read_id": "release_package_validator",
      "surface": "scripts/validate_release_package.py",
      "surface_type": "validator",
      "read_type": "full_source",
      "status": "satisfied",
      "owner_slice": "slice_001",
      "evidence_ref": "scripts/validate_release_package.py",
      "summary": "Dependency-free validator proving required public release files, CI commands, generated entrypoint freshness, example validation, version/changelog alignment, and clean tracked package paths."
    },
    {
      "read_id": "vbtprobuild_wave_1_11_evidence_copy",
      "surface": "evidence/vbtprobuild_wave_1_11_20260514/manifest.json",
      "surface_type": "other",
      "read_type": "docs",
      "status": "satisfied",
      "owner_slice": "workflow_evidence_import",
      "evidence_ref": "evidence/vbtprobuild_wave_1_11_20260514/manifest.json",
      "summary": "Copied vbtprobuild Wave 1-11 indexed tmp reports, crack-repair audits, plan, checkpoint, receipt, helper reconciliation, and targeted index extracts used to preserve the repo-agnostic workflow evidence."
    },
    {
      "read_id": "vbtprobuild_slice_01_19_progression_audit",
      "surface": "/home/benji/vbtprobuild/plans/v7_2_4/slice_01_19_v2_addition_overlay_polish_20260507.json",
      "surface_type": "external_source",
      "read_type": "docs",
      "status": "satisfied",
      "owner_slice": "workflow_evidence_import",
      "evidence_ref": "reports/vbtprobuild_slice_01_19_vs_wave_1_11_progression_audit_20260514.json",
      "summary": "Read-only audit of vbtprobuild V7.2.4 slice 01-19 plan, git progression, plan-note index, output-schema index, repo index, full slice audit, and comparison against Wave 1-11 governance."
    },
    {
      "read_id": "vbtprobuild_slice_01_19_layer_planning_audit",
      "surface": "/home/benji/vbtprobuild/docs/v2/production/v7_2_4_accepted_four_layer_stack_20260507/00_repo_owned_accepted_four_layer_stack_manifest.json",
      "surface_type": "external_source",
      "read_type": "docs",
      "status": "satisfied",
      "owner_slice": "workflow_evidence_import",
      "evidence_ref": "reports/vbtprobuild_slice_01_19_layer_planning_audit_20260514.json",
      "summary": "Read-only audit of vbtprobuild V7.2.4 accepted four-layer stack for slices 01-19: foundation lifecycle, contract application, semantic application, fine-detail maps, and work orders."
    }
  ]
}
